{
  "schema_version": "mechanism-spec-v1",
  "domain": "healthcare",
  "implementation_status": "executable_synthetic_workflow_pending_clinical_calibration",
  "mechanisms": [
    {
      "mechanism_id": "healthcare.scheduled_temperature_observation",
      "source_event_type_ids": [],
      "target_event_type_id": "healthcare.observation.vital_sign.temperature_recorded",
      "parent_combination": "none",
      "parent_attribution_mode": "independent_background",
      "required_context_relation_type_ids": ["healthcare.device_monitors_patient", "healthcare.encounter_has_patient"],
      "temporal_model_family": "scheduled_time",
      "generation_temporal_model_ref": "core.scheduled",
      "covariate_fields": [],
      "relation_semantics": "scheduled",
      "evidence_policy": "configured_schedule",
      "calibration_fitter_id": null,
      "parameter_status": "policy_defined"
    },
    {
      "mechanism_id": "healthcare.scheduled_oxygen_saturation_observation",
      "source_event_type_ids": [],
      "target_event_type_id": "healthcare.observation.vital_sign.oxygen_saturation_recorded",
      "parent_combination": "none",
      "parent_attribution_mode": "independent_background",
      "required_context_relation_type_ids": ["healthcare.device_monitors_patient", "healthcare.encounter_has_patient"],
      "temporal_model_family": "scheduled_time",
      "generation_temporal_model_ref": "core.scheduled",
      "covariate_fields": [],
      "relation_semantics": "scheduled",
      "evidence_policy": "configured_schedule",
      "calibration_fitter_id": null,
      "parameter_status": "policy_defined"
    },
    {
      "mechanism_id": "healthcare.scheduled_specimen_collection",
      "source_event_type_ids": [],
      "target_event_type_id": "healthcare.specimen.collection.completed",
      "parent_combination": "none",
      "parent_attribution_mode": "independent_background",
      "required_context_relation_type_ids": ["healthcare.specimen_from_patient", "healthcare.encounter_has_patient"],
      "temporal_model_family": "scheduled_time",
      "generation_temporal_model_ref": "core.scheduled",
      "covariate_fields": [],
      "relation_semantics": "scheduled",
      "evidence_policy": "configured_schedule",
      "calibration_fitter_id": null,
      "parameter_status": "policy_defined"
    },
    {
      "mechanism_id": "healthcare.specimen_to_lab_result",
      "source_event_type_ids": ["healthcare.specimen.collection.completed"],
      "target_event_type_id": "healthcare.observation.laboratory.result_recorded",
      "parent_combination": "single",
      "required_context_relation_type_ids": ["healthcare.specimen_from_patient"],
      "temporal_model_family": "conditional_lognormal",
      "generation_temporal_model_ref": "healthcare.lab_turnaround.prior_v1",
      "covariate_fields": ["priority"],
      "relation_semantics": "workflow",
      "evidence_policy": "explicit_link",
      "calibration_fitter_id": null,
      "parameter_status": "pending_reference_data"
    },
    {
      "mechanism_id": "healthcare.observation_to_threshold_flag",
      "source_event_type_ids": [
        "healthcare.observation.vital_sign.temperature_recorded",
        "healthcare.observation.vital_sign.oxygen_saturation_recorded",
        "healthcare.observation.laboratory.result_recorded"
      ],
      "target_event_type_id": "healthcare.finding.configured_threshold_flag.created",
      "parent_combination": "single",
      "required_context_relation_type_ids": [],
      "temporal_model_family": "deterministic_delay",
      "generation_temporal_model_ref": "core.immediate",
      "covariate_fields": [],
      "relation_semantics": "derivation",
      "evidence_policy": "rule_supported",
      "calibration_fitter_id": null,
      "parameter_status": "policy_defined",
      "notes": "A configured synthetic reference profile creates the flag. This is not a diagnosis."
    },
    {
      "mechanism_id": "healthcare.flag_to_alert",
      "source_event_type_ids": ["healthcare.finding.configured_threshold_flag.created"],
      "target_event_type_id": "healthcare.workflow.monitoring_alert.created",
      "parent_combination": "single",
      "required_context_relation_type_ids": [],
      "temporal_model_family": "deterministic_delay",
      "generation_temporal_model_ref": "healthcare.alert_processing.policy_v1",
      "covariate_fields": [],
      "relation_semantics": "derivation",
      "evidence_policy": "rule_supported",
      "calibration_fitter_id": null,
      "parameter_status": "policy_defined"
    },
    {
      "mechanism_id": "healthcare.multisignal_flags_to_alert",
      "source_event_type_ids": ["healthcare.finding.configured_threshold_flag.created"],
      "target_event_type_id": "healthcare.workflow.monitoring_alert.created",
      "parent_combination": "all_of",
      "required_context_relation_type_ids": [],
      "temporal_model_family": "deterministic_delay",
      "generation_temporal_model_ref": "healthcare.alert_processing.policy_v1",
      "covariate_fields": [],
      "relation_semantics": "derivation",
      "evidence_policy": "rule_supported",
      "calibration_fitter_id": null,
      "parameter_status": "policy_defined"
    },
    {
      "mechanism_id": "healthcare.alert_to_clinical_review",
      "source_event_type_ids": ["healthcare.workflow.monitoring_alert.created"],
      "target_event_type_id": "healthcare.workflow.clinical_review.completed",
      "parent_combination": "single",
      "required_context_relation_type_ids": ["healthcare.practitioner_responsible_for_patient"],
      "temporal_model_family": "conditional_lognormal",
      "generation_temporal_model_ref": "healthcare.review_delay.prior_v1",
      "covariate_fields": ["urgency_level", "workload_level"],
      "relation_semantics": "workflow",
      "evidence_policy": "explicit_link",
      "calibration_fitter_id": null,
      "parameter_status": "pending_reference_data"
    },
    {
      "mechanism_id": "healthcare.review_to_care_plan_adjustment",
      "source_event_type_ids": ["healthcare.workflow.clinical_review.completed"],
      "target_event_type_id": "healthcare.intervention.care_plan.adjusted",
      "parent_combination": "single",
      "required_context_relation_type_ids": [],
      "temporal_model_family": "conditional_lognormal",
      "generation_temporal_model_ref": "healthcare.care_plan_delay.prior_v1",
      "covariate_fields": ["urgency_level"],
      "relation_semantics": "workflow",
      "evidence_policy": "explicit_link",
      "calibration_fitter_id": null,
      "parameter_status": "pending_reference_data",
      "notes": "The adjustment is intentionally non-prescriptive: no diagnosis, medication, dose, or outcome efficacy is asserted."
    },
    {
      "mechanism_id": "healthcare.care_plan_to_follow_up_observation",
      "source_event_type_ids": ["healthcare.intervention.care_plan.adjusted"],
      "target_event_type_id": "healthcare.observation.follow_up.recorded",
      "parent_combination": "single",
      "required_context_relation_type_ids": ["healthcare.device_monitors_patient"],
      "temporal_model_family": "conditional_lognormal",
      "generation_temporal_model_ref": "healthcare.follow_up_delay.prior_v1",
      "covariate_fields": ["urgency_level"],
      "relation_semantics": "workflow",
      "evidence_policy": "explicit_link",
      "calibration_fitter_id": null,
      "parameter_status": "pending_reference_data"
    },
    {
      "mechanism_id": "healthcare.follow_up_to_status_assessment",
      "source_event_type_ids": ["healthcare.observation.follow_up.recorded"],
      "target_event_type_id": "healthcare.finding.follow_up_status.assessed",
      "parent_combination": "single",
      "required_context_relation_type_ids": [],
      "temporal_model_family": "deterministic_delay",
      "generation_temporal_model_ref": "core.immediate",
      "covariate_fields": [],
      "relation_semantics": "derivation",
      "evidence_policy": "rule_supported",
      "calibration_fitter_id": null,
      "parameter_status": "policy_defined",
      "notes": "The generated status records whether the synthetic value entered its configured reference band; it does not claim treatment effectiveness."
    },
    {
      "mechanism_id": "healthcare.routine_repeat_observation",
      "source_event_type_ids": [
        "healthcare.observation.vital_sign.temperature_recorded",
        "healthcare.observation.vital_sign.oxygen_saturation_recorded"
      ],
      "target_event_type_id": "healthcare.observation.follow_up.recorded",
      "parent_combination": "single",
      "required_context_relation_type_ids": ["healthcare.device_monitors_patient"],
      "temporal_model_family": "scheduled_time",
      "generation_temporal_model_ref": "core.scheduled",
      "covariate_fields": [],
      "relation_semantics": "scheduled",
      "evidence_policy": "configured_schedule",
      "calibration_fitter_id": null,
      "parameter_status": "policy_defined"
    }
  ]
}
